{
  "admission_decision_ref": "admission://sc/workload-001/decision",
  "authority_boundary": {
    "authority_transfer": false,
    "fork_participates_in_runtime_control": false,
    "fork_validates_causality": false,
    "fork_validates_sc_governance": false
  },
  "authority_domain": "SC zero-trust execution and governance environment",
  "cbo_id": "cbo-sc-workload-001",
  "cbo_version": "0.1",
  "digest_seal_anchor_metadata": {
    "anchor_refs": [],
    "anchor_status": "pending",
    "digest_algorithm": "SHA-256",
    "digest_value": "pending",
    "seal_status": "pending"
  },
  "downstream_do_not_infer": [
    "Do not infer governance authority beyond emitted evidence.",
    "Do not infer runtime control authority.",
    "Do not infer compliance or safety approval.",
    "Do not infer semantic validation of SC-declared invariant references."
  ],
  "emitted_artifact_refs": [
    "artifact://continuity-packet/workload-001"
  ],
  "emitted_at": "2026-06-20T00:00:00Z",
  "execution_event_refs": [
    "aws://execution/workload-001",
    "kubernetes://pod/workload-001",
    "kafka://topic/sc-continuity/workload-001"
  ],
  "issuer_system": "Supreme Computation",
  "preservation_refs": [],
  "recomputation_refs": [],
  "sc_claims": [
    "This packet represents a governed continuity path emitted from an SC execution environment."
  ],
  "sc_declared_invariant_refs": [
    "invariant://time",
    "invariant://continuity",
    "invariant://alignment",
    "invariant://genesis",
    "invariant://boundary",
    "invariant://reference",
    "invariant://causality",
    "invariant://consciousness"
  ],
  "sc_non_claims": [
    "This packet does not require Fork to validate SC governance authority.",
    "This packet does not grant Fork admission, authorization, safety, compliance, or causal authority."
  ],
  "stable_workload_id": "sc-workload-001",
  "state_transition_refs": [
    "state://workload-001/admitted",
    "state://workload-001/executing",
    "state://workload-001/emitted"
  ],
  "unresolved_or_excluded_refs": [
    "credentials",
    "live control access",
    "proprietary internal machinery"
  ]
}
